productId,partNumber,brand,name,description,status,imageUrl,catalogUrl,particleSize,poreSize,columnLength,innerDiameter,phaseType,phMin,phMax,phRange,usp,maxPressure,maxTemperature
THER-SecurityGuard-C18,SecurityGuard-C18,Thermo Fisher Scientific,SecurityGuard C18,SecurityGuard C18; Series: SecurityGuard; Phase Type: C18; For HPLC Column Protection,active,https://assets.thermofisher.com/TFS-Assets/CMD/product-images/guard-securityguard.jpg,https://www.thermofisher.com/products/guard/securityguard-c18,,,,,C18,,,,,,
THER-SecurityGuard-C8,SecurityGuard-C8,Thermo Fisher Scientific,SecurityGuard C8,SecurityGuard C8; Series: SecurityGuard; Phase Type: C8; For HPLC Column Protection,active,https://assets.thermofisher.com/TFS-Assets/CMD/product-images/guard-securityguard.jpg,https://www.thermofisher.com/products/guard/securityguard-c8,,,,,C8,,,,,,
THER-SecurityGuard-Phenyl,SecurityGuard-Phenyl,Thermo Fisher Scientific,SecurityGuard Phenyl,SecurityGuard Phenyl; Series: SecurityGuard; Phase Type: Phenyl; For HPLC Column Protection,active,https://assets.thermofisher.com/TFS-Assets/CMD/product-images/guard-securityguard.jpg,https://www.thermofisher.com/products/guard/securityguard-phenyl,,,,,Phenyl,,,,,,
THER-GuardCartridge-C18,GuardCartridge-C18,Thermo Fisher Scientific,Guard Cartridge C18,Guard Cartridge C18; Series: Guard Cartridge; Phase Type: C18; For HPLC Column Protection,active,https://assets.thermofisher.com/TFS-Assets/CMD/product-images/guard-guard-cartridge.jpg,https://www.thermofisher.com/products/guard/guardcartridge-c18,,,,,C18,,,,,,
THER-GuardCartridge-C8,GuardCartridge-C8,Thermo Fisher Scientific,Guard Cartridge C8,Guard Cartridge C8; Series: Guard Cartridge; Phase Type: C8; For HPLC Column Protection,active,https://assets.thermofisher.com/TFS-Assets/CMD/product-images/guard-guard-cartridge.jpg,https://www.thermofisher.com/products/guard/guardcartridge-c8,,,,,C8,,,,,,
THER-GuardCartridge-Phenyl,GuardCartridge-Phenyl,Thermo Fisher Scientific,Guard Cartridge Phenyl,Guard Cartridge Phenyl; Series: Guard Cartridge; Phase Type: Phenyl; For HPLC Column Protection,active,https://assets.thermofisher.com/TFS-Assets/CMD/product-images/guard-guard-cartridge.jpg,https://www.thermofisher.com/products/guard/guardcartridge-phenyl,,,,,Phenyl,,,,,,
THER-In-LineFilter-C18,In-LineFilter-C18,Thermo Fisher Scientific,In-Line Filter C18,In-Line Filter C18; Series: In-Line Filter; Phase Type: C18; For HPLC Column Protection,active,https://assets.thermofisher.com/TFS-Assets/CMD/product-images/guard-in-line-filter.jpg,https://www.thermofisher.com/products/guard/in-linefilter-c18,,,,,C18,,,,,,
THER-In-LineFilter-C8,In-LineFilter-C8,Thermo Fisher Scientific,In-Line Filter C8,In-Line Filter C8; Series: In-Line Filter; Phase Type: C8; For HPLC Column Protection,active,https://assets.thermofisher.com/TFS-Assets/CMD/product-images/guard-in-line-filter.jpg,https://www.thermofisher.com/products/guard/in-linefilter-c8,,,,,C8,,,,,,
THER-In-LineFilter-Phenyl,In-LineFilter-Phenyl,Thermo Fisher Scientific,In-Line Filter Phenyl,In-Line Filter Phenyl; Series: In-Line Filter; Phase Type: Phenyl; For HPLC Column Protection,active,https://assets.thermofisher.com/TFS-Assets/CMD/product-images/guard-in-line-filter.jpg,https://www.thermofisher.com/products/guard/in-linefilter-phenyl,,,,,Phenyl,,,,,,
